{"schema_version":1,"contract_id":"OMNIA-DEMO-001","contract_revision":1,"contract_digest":"sha256:dddddddddddddddddddddddddddddddddddddddddddddddddddddddddddddddd","evaluated_as_of":"2026-10-02T00:00:00Z","execution":"cancelled","verification":"unverified","human_acceptance":"pending","lifecycle":"cancelled","source_freshness":"unknown","criteria":[{"id":"AC-001","verification":"unverified","evidence":[{"id":"EVD-001","artifact_sha256":"sha256:eeeeeeeeeeeeeeeeeeeeeeeeeeeeeeeeeeeeeeeeeeeeeeeeeeeeeeeeeeeeeeee","state":"stale"}]}]}
