{"schema_version":1,"contract_id":"OMNIA-DEMO-001","contract_revision":1,"contract_digest":"sha256:dddddddddddddddddddddddddddddddddddddddddddddddddddddddddddddddd","evaluated_as_of":"2026-10-09T00:00:00Z","execution":"paused","verification":"unverified","human_acceptance":"pending","lifecycle":"expired","source_freshness":"observed-current","criteria":[{"id":"AC-001","verification":"unverified","evidence":[{"id":"EVD-002","artifact_sha256":"sha256:ffffffffffffffffffffffffffffffffffffffffffffffffffffffffffffffff","state":"missing"}]}]}
